"Link Prediction in Industrial Knowledge Graphs: A Case Study on Football Manufacturing","M. Yahya; A. Wahid; L. Yang; J. G. Breslin; E. Kharlamov; M. Intizar Ali","Data Science Institute, University of Galway, Galway, Ireland; Data Science Institute, University of Galway, Galway, Ireland; Data Science Institute, University of Galway, Galway, Ireland; Data Science Institute, University of Galway, Galway, Ireland; Bosch Center for Artificial Intelligence, Stuttgart, Germany; School of Electronic Engineering, Dublin City University, Dublin 9, Ireland",IEEE Access,"2 Jul 2024","2024","12","","89804","89817","The integration of heterogeneous and unstructured data in Industry 4.0, poses a significant challenge, particularly with advanced manufacturing techniques. To address this issue, Knowledge Graphs (KGs) have emerged as a pivotal technology, yet their deployment often encounters the problem of incompletion due to data diversity and diverse storage formats. This study tackles the challenge of KG completion by applying and evaluating state-of-the-art KG embedding models-ComplEx, DistMult, TransE, ConvKB, and ConvE-within a football manufacturing production line context. Our analysis employs two principal metrics of Mean Reciprocal Rank (MRR) and Hits@N (Hits@10, Hits@3, and Hits@1) to comprehensively assess model performance. Our findings reveal that TransE significantly outperforms its counterparts, achieving an average accuracy of 91%, closely followed by ComplEx and DistMult with accuracies of 87% and 84%, respectively. Conversely, ConvKB and ConvE exhibit lower performance levels, with accuracy values of 79% and 76%. Through rigorous statistical testing, including t-tests, meaningful differences in MRR values across the models have been observed, with TransE leading in MRR and ConvE at the lower end of the spectrum. Our research not only sheds light on the efficacy of various KG embedding models in managing tree-like structured datasets within the manufacturing domain but also offers insights into optimising KGs for improved integration and analysis of data in production lines. These contributions are valuable both from academic research in KG completion and industrial practices aiming to enhance production efficiency and data coherence in advanced manufacturing settings.","2169-3536","","10.1109/ACCESS.2024.3419911","Science Foundation Ireland (SFI) (Insight)(grant numbers:12/RC/2289_P2); SFI (Confirm)(grant numbers:16/RC/3918); European Union (OntoCommons)(grant numbers:958371); ","https://ieeexplore.ieee.org/stamp/stamp.jsp?arnumber=10574531","Industry 4.0;knowledge graph completion;link prediction;smart manufacturing","Production;Predictive models;Manufacturing;Data models;Ontologies;Topology;Knowledge graphs","","5","","59","CCBY","27 Jun 2024","2024","","IEEE","IEEE Journals"
"Zero-Shot Text Classification via Knowledge Graph Embedding for Social Media Data","Q. Chen; W. Wang; K. Huang; F. Coenen","School of Advanced Technology, Xi’an Jiaotong-Liverpool University, Suzhou, China; School of Advanced Technology, Xi’an Jiaotong-Liverpool University, Suzhou, China; School of Advanced Technology, Xi’an Jiaotong-Liverpool University, Suzhou, China; Department of Computer Science, University of Liverpool, Liverpool, U.K.",IEEE Internet of Things Journal,"7 Jun 2022","2022","9","12","9205","9213","The idea of “citizen sensing” and “human as sensors” is crucial for social Internet of Things, an integral part of cyber–physical–social systems (CPSSs). Social media data, which can be easily collected from the social world, has become a valuable resource for research in many different disciplines, e.g., crisis/disaster assessment, social event detection, or the recent COVID-19 analysis. Useful information, or knowledge derived from social data, could better serve the public if it could be processed and analyzed in more efficient and reliable ways. Advances in deep neural networks have significantly improved the performance of many social media analysis tasks. However, deep learning models typically require a large amount of labeled data for model training, while most CPSS data is not labeled, making it impractical to build effective learning models using traditional approaches. In addition, the current state-of-the-art, pretrained natural language processing (NLP) models do not make use of existing knowledge graphs, thus often leading to unsatisfactory performance in real-world applications. To address the issues, we propose a new zero-shot learning method which makes effective use of existing knowledge graphs for the classification of very large amounts of social text data. Experiments were performed on a large, real-world tweet data set related to COVID-19, the evaluation results show that the proposed method significantly outperforms six baseline models implemented with state-of-the-art deep learning models for NLP.","2327-4662","","10.1109/JIOT.2021.3093065","Research Development Fund at Xi’an Jiaotong-Liverpool University(grant numbers:RDF-16-01-34); National Natural Science Foundation of China(grant numbers:61876155); Natural Science Foundation of Jiangsu Province(grant numbers:BK20181189,BE2020006-4B); part by the Key Program Special Fund in XJTLU(grant numbers:KSF-T-06,KSF-E-05); ","https://ieeexplore.ieee.org/stamp/stamp.jsp?arnumber=9466939","Internet of Things (IoT);knowledge graph;natural language processing (NLP);social media data analysis;zero-shot learning","Social networking (online);Data models;Task analysis;Sensors;Internet of Things;Bit error rate;Predictive models","","38","","45","IEEE","29 Jun 2021","15 June15, 2022","","IEEE","IEEE Journals"
"Trust-Aware Multi-Task Knowledge Graph for Recommendation","Y. Zhou; J. Guo; B. Song; C. Chen; J. Chang; F. R. Yu","State Key Laboratory of Integrated Services Networks, Xidian University, Xi’An, Shaanxi, China; State Key Laboratory of Integrated Services Networks, Xidian University, Xi’An, Shaanxi, China; State Key Laboratory of Integrated Services Networks, Xidian University, Xi’An, Shaanxi, China; State Key Laboratory of Integrated Services Networks, Xidian University, Xi’An, Shaanxi, China; Guangdong OPPO Mobile Telecommunications Corp., Ltd, Dongguan, Guangdong, China; Guangdong Laboratory of Artificial Intelligence and Digital Economy (SZ), Shenzhen University, Shenzhen, Guangdong, China",IEEE Transactions on Knowledge and Data Engineering,"7 Jul 2023","2023","35","8","8658","8671","Data sparsity and cold start problems are common in recommender systems. Adding some side information, such as knowledge graph and users’ trust relationship, is an effective method to alleviate these problems. However, few work jointly explore the fine-grained implicit relationships between the external heterogeneous graphs to enhance the recommendation accuracy. To address this issue, in this paper, we propose a new method named Trust-aware Multi-task Knowledge Graph (TMKG), which uses multi-task learning to integrate two kinds of side information of trust graph and knowledge graph in an end-to-end manner. First, we mine the intra-graph and inter-graph high-order connections through the node propagation and aggregation, and optimize the embedding of nodes through the implicit relationships obtained. Furthermore, through the shared cross unit, the connection relationships between each layer is mined, and the high-order interaction of nodes of different layers is obtained. We conduct extensive experiments on real-world datasets and prove that our model has the superior performance compared with the state-of-the-art models.","1558-2191","","10.1109/TKDE.2022.3221160","National Natural Science Foundation of China(grant numbers:62071354,62201424,62271324); China Postdoctoral Science Foundation(grant numbers:2017M620438); Natural Science Foundation of Shaanxi Province(grant numbers:2019ZDLGY03-03); Xidian University; ","https://ieeexplore.ieee.org/stamp/stamp.jsp?arnumber=9944959","Knowledge graph;multi-task learning;recommender systems;trust graph","Task analysis;Multitasking;Recommender systems;Social networking (online);Knowledge engineering;Collaboration;Neural networks","","9","","55","IEEE","10 Nov 2022","1 Aug. 2023","","IEEE","IEEE Journals"
"Context-Aware and Semantic-Synergistic Linguistic Steganalysis for Social Networks","Y. Jiang; Z. Yang; X. Xu; Q. Niu; J. Zhao","School of Cyberspace Security, Beijing University of Posts and Telecommunications, Beijing, China; School of Cyberspace Security, Beijing University of Posts and Telecommunications, Beijing, China; Tsinghua University, Beijing, China; School of Cyberspace Security, Beijing University of Posts and Telecommunications, Beijing, China; School of Computer Science, Beijing University of Posts and Telecommunications, Beijing, China",IEEE Signal Processing Letters,"25 Dec 2025","2026","33","","191","195","Steganographic threats are widespread in social networks, particularly on social media platforms. Existing methods mainly rely on statistical features and social network graph-based modeling, but struggle under sparsity and fragmentation due to limited semantics and weak graph connections that fail to capture deep inter-text dependencies. Therefore, we propose the CASS-LS framework, a Context-Aware and Semantic-Synergistic Linguistic Steganalysis framework for social network. CASS-LS consists of three key modules. The Semantic-Aware Feature Pretraining (SAFP) module generates more discriminative semantic representations to enhance the expressiveness of fragmented texts. The Semantic Synergy and Context-Aware Modeling (SSCA) module strengthens graph-based modeling to reconstruct inter-text relationships and capture long-range dependencies among sparse texts. The Semantics-Context-Synergistic Contrastive Loss Supervision (SCS-CLS) module compares semantic and contextual similarities between text pairs, improving model performance in detecting weak steganographic signals. Extensive experiments demonstrate that CASS-LS achieves superior F1 performance in social network steganalysis tasks.","1558-2361","","10.1109/LSP.2025.3639346","National Natural Science Foundation of China(grant numbers:U21B2020); ","https://ieeexplore.ieee.org/stamp/stamp.jsp?arnumber=11271828","Steganography;robustness;paraphrasing attacks;steganalysis","Semantics;Social networking (online);Context modeling;Training;Standards;Vectors;Transformers;Steganography;Robustness;Payloads","","1","","29","IEEE","2 Dec 2025","2026","","IEEE","IEEE Journals"
"Graph-Based Non-Sampling for Knowledge Graph Enhanced Recommendation","S. Liang; J. Shao; J. Zhang; B. Cui","Center for Future Media, School of Computer Science and Engineering, University of Electronic Science and Technology of China, Chengdu, China; Center for Future Media, School of Computer Science and Engineering, University of Electronic Science and Technology of China, Chengdu, China; Center for Future Media, School of Computer Science and Engineering, University of Electronic Science and Technology of China, Chengdu, China; Department of Computer Science, Key Laboratory of High Confidence Software Technologies (MOE), Peking University, Beijing, China",IEEE Transactions on Knowledge and Data Engineering,"7 Aug 2023","2023","35","9","9462","9475","Knowledge graph (KG) enhanced recommendation, which aims to solve the cold start and explainability in recommender systems, has attracted considerable research interest recently. Existing recommender systems usually focus on implicit feedback such as purchase history without negative feedback. Most of them apply the negative sampling strategy to deal with the implicit feedback data, which may ignore the latent positive user-item interaction. Some other works adopt the non-sampling strategy that treats all non-observed interactions as negative samples and assigns a weight for each negative sample to represent the probability that this sample is a positive sample. However, they use a simple and intuitive weight assignment strategy and cannot catch the latent relationship from all interaction data. To address these problems, we consider graph structure information of both user-item interaction and knowledge graph, and propose a Graph-based Non-Sampling strategy to achieve efficient performance in Knowledge graph enhanced Recommendation (GNSKR). GNSKR utilizes node centrality to significantly improve recommendation performance with low computation cost. Meanwhile, we combine knowledge graph embedding and recommendation task with a local aggregation block, which efficiently catches the high-order connection information in KG enhanced recommendation. Experiments on three datasets show that GNSKR embraces the state-of-the-art with competitive efficiency.","1558-2191","","10.1109/TKDE.2023.3240832","National Natural Science Foundation of China(grant numbers:61832001,62276047); Sichuan Science and Technology Program(grant numbers:2023JDRC0086); Shenzhen Science and Technology Program(grant numbers:JCYJ20210324121213037); Zhejiang Lab's International Talent Fund for Young Professionals; ","https://ieeexplore.ieee.org/stamp/stamp.jsp?arnumber=10032820","Graph neural network;knowledge graph enhanced recommendation;knowledge graph embedding;non-sampling strategy","Recommender systems;Task analysis;Knowledge engineering;Data models;Motion pictures;Training;Social networking (online)","","23","","50","IEEE","31 Jan 2023","1 Sept. 2023","","IEEE","IEEE Journals"
"Social-Enhanced Explainable Recommendation With Knowledge Graph","C. Liu; W. Wu; S. Wu; L. Yuan; R. Ding; F. Zhou; Q. Wu","College of Communication and Information Engineering, Nanjing University of Posts and Telecommunications, Nanjing, China; College of Communication and Information Engineering, Nanjing University of Posts and Telecommunications, Nanjing, China; Ph.D student in the Learning and Performance Systems Department of the College of Education, Pennsylvania State University, Center Valley, PA, USA; College of Electronic and Information Engineering, Nanjing University of Aeronautics and Astronautics, Nanjing, China; College of Electronic and Information Engineering, Nanjing University of Aeronautics and Astronautics, Nanjing, China; College of Electronic and Information Engineering, Nanjing University of Aeronautics and Astronautics, Nanjing, China; College of Electronic and Information Engineering, Nanjing University of Aeronautics and Astronautics, Nanjing, China",IEEE Transactions on Knowledge and Data Engineering,"10 Jan 2024","2024","36","2","840","853","Recommendation systems are of crucial importance due to their wide applications. Knowledge graph (KG) enabled recommendation schemes have attracted great attention due to their superior performance and interpretability. However, the rich social information is not exploited for those systems, which limits the recommendation performance (Wang et al., 2023). In this paper, a novel explainable recommendation scheme is proposed by exploiting our designed social enhanced knowledge graph attention network (SKGAN). The hidden relations among users and items are learned and used for recommendation with the collaborative KG (CKG) and the user social graph (USG). Moreover, the high-order semantic information in both CKG and USG are obtained by using the graph convolution networks (GCNs) and the node level attention algorithm. Furthermore, a graph level user-specific attention algorithm is proposed to capture the user personalized preference between CKG and USG. Extensive experiment results demonstrate that normalized discounted cumulative gain (NDCG), precision, recall and hits ratio (HR) achieved with our proposed recommendation system are the best among those obtained with the state-of-the-art benchmark recommendation systems.","1558-2191","","10.1109/TKDE.2023.3292504","National Key R&D Program of China(grant numbers:2020YFB1807602); National Natural Science Foundation of China(grant numbers:62271267,62222107,62071223,62031012); Zhejiang Lab Open Research Project(grant numbers:K2022PD0AB09); ","https://ieeexplore.ieee.org/stamp/stamp.jsp?arnumber=10173618","Graph convolution networks;knowledge graph;recommendation system;user social graph","Knowledge graphs;Semantics;Recommender systems;Social networking (online);Graph neural networks;Convolution;Electronic mail","","36","","53","IEEE","5 Jul 2023","Feb. 2024","","IEEE","IEEE Journals"
"Integrating Knowledge Graphs and Complex Network Analysis for Effective Team Formation in New Product Development Projects","Q. Yang; P. Tian; I. Krystallis; Y. Han; T. Yao","School of Economics and Management, University of Science and Technology Beijing, Beijing, China; School of Management Science and Engineering, Tianjin University of Finance and Economics, Tianjin, China; The Bartlett School of Sustainable Construction, University College London, London, U.K.; School of Economics and Management, University of Science and Technology Beijing, Beijing, China; Antai College of Economics & Management, Shanghai Jiao Tong University, Shanghai, China",IEEE Transactions on Engineering Management,"4 Jun 2026","2026","73","","3610","3624","Forming an effective project team to rapidly develop new products is a significant challenge that involves selecting project members and assigning them to subteams. This article proposes an innovative method for team formation by combining digital approaches (i.e., knowledge graphs) with traditional modeling methods (i.e., complex network analysis). First, to search candidate members for a target new product development (NPD) project, we build the NPD project knowledge graph and identify completed projects with high similarity to the target project from a complex network perspective (i.e., structural similarity and attribute similarity). We select the members of these completed projects as the candidate team member set for the target project. Second, to calculate the dependency strength among members, we match members and activities based on expertise consistency and propose a method for calculating dependency strength under two scenarios by building a “activity-organization” network. Finally, to partition the team network into several subteams and identify overlapping members, we propose an improved Linkcomm algorithm to cluster the network. An industrial case validates the proposed method. To ensure research rigor, we conduct robustness checks (i.e., parameter test and added-variable test), sensitivity analysis, and comparative experiments against the traditional model. This article contributes to both theory and practice of project team formation.","1558-0040","","10.1109/TEM.2026.3693651","National Natural Science Foundation of China(grant numbers:72271022,W2441021); ","https://ieeexplore.ieee.org/stamp/stamp.jsp?arnumber=11520616","Complex network;knowledge graph;new product development project;organizational clustering;team formation","Design methodology;Modeling;Transmission electron microscopy;Knowledge graphs;Management;Algorithms;Organizations;Social networking (online);Educational institutions;Collaboration","","","","52","IEEE","14 May 2026","2026","","IEEE","IEEE Journals"
"Multisource-Knowledge-Based Approach for Crowd Evacuation Navigation","P. Zhang; K. Zhao; H. Liu; W. Li","School of Information Science and Engineering, Shandong Normal University, Jinan, China; Inspur (ShanDong) Computer Technology Company Ltd., Jinan, China; School of Information Science and Engineering, Shandong Normal University, Jinan, China; School of Information Science and Engineering, Shandong Normal University, Jinan, China",IEEE Transactions on Computational Social Systems,"13 Jun 2024","2024","11","3","4524","4539","In crowd evacuation research, the knowledge contained in crowd evacuation is very complex and is multisource. Crowd evacuation scenarios restrict pedestrians’ movement decision-making, and the movement states of the crowd imply the movement characteristics. However, the existing studies on crowd evacuation navigation approach cannot make full use of the complex and multisource crowd evacuation knowledge, which reduces the effect of the evacuation navigation. To solve this problem, a new crowd evacuation navigation approach based on multisource knowledge is proposed. First, we collect relevant data on crowd evacuation using an image sensor network and establish a crowd evacuation knowledge graph to organize and store this data. Second, the explicit knowledge of scene structure and crowd movements is represented based on the crowd evacuation knowledge graph. Then, a deep-learning-based tacit knowledge model (DLTKM) is designed to extract the tacit knowledge of different groups and scene entities. Finally, a new crowd evacuation navigation approach based on wireless sensor network and related knowledge representations is designed to plan evacuation paths for evacuees. The experiment results show that this approach can plan reasonable evacuation paths for pedestrians, and improve the efficiency of crowd evacuations.","2329-924X","","10.1109/TCSS.2024.3381840","National Natural Science Foundation of China(grant numbers:62276156,61876102,61972237); Natural Science Foundation of Shandong Province of China(grant numbers:ZR2022LZH019); ","https://ieeexplore.ieee.org/stamp/stamp.jsp?arnumber=10510393","Crowd evacuation knowledge graph;crowd evacuation navigation;multisource knowledge;sensor network","Navigation;Pedestrians;Knowledge graphs;Roads;Wireless sensor networks;Image sensors;Planning","","8","","47","IEEE","30 Apr 2024","June 2024","","IEEE","IEEE Journals"
"Resorting to Context-Aware Background Knowledge for Unveiling Semantically Related Social Media Posts","A. Sakor; K. Singh; M. -E. Vidal","TIB Leibniz Information Centre for Science and Technology, Leibniz University of Hannover, Hannover, Germany; Zerotha Research, Hannover, Germany; TIB Leibniz Information Centre for Science and Technology, Leibniz University of Hannover, Hannover, Germany",IEEE Access,"8 Nov 2022","2022","10","","115351","115371","Social media networks have become a prime source for sharing news, opinions, and research accomplishments in various domains, and hundreds of millions of posts are announced daily. Given this wealth of information in social media, finding related announcements has become a relevant task, particularly in trending news (e.g., COVID-19 or lung cancer). To facilitate the search of connected posts, social networks enable users to annotate their posts, e.g., with hashtags in tweets. Albeit effective, an annotation-based search is limited because results will only include the posts that share the same annotations. This paper focuses on retrieving context-related posts based on a specific topic, and presents PINYON, a knowledge-driven framework, that retrieves associated posts effectively. PINYON implements a two-fold pipeline. First, it encodes, in a graph, a CORPUS of posts and an input post; posts are annotated with entities for existing knowledge graphs and connected based on the similarity of their entities. In a decoding phase, the encoded graph is used to discover communities of related posts. We cast this problem into the Vertex Coloring Problem, where communities of similar posts include the posts annotated with entities colored with the same colors. Built on results reported in the graph theory, PINYON implements the decoding phase guided by a heuristic-based method that determines relatedness among posts based on contextual knowledge, and efficiently groups the most similar posts in the same communities. PINYON is empirically evaluated on various datasets and compared with state-of-the-art implementations of the decoding phase. The quality of the generated communities is also analyzed based on multiple metrics. The observed outcomes indicate that PINYON accurately identifies semantically related posts in different contexts. Moreover, the reported results put in perspective the impact of known properties about the optimality of existing heuristics for vertex graph coloring and their implications on PINYON scalability.","2169-3536","","10.1109/ACCESS.2022.3217492","European Union (EU) H2020 Research and Innovation Action (RIA) Project CLARIFY(grant numbers:875160); Federal Ministry for Economic Affairs and Energy of Germany in the project Cognitive Economy Intelligence Plattform für die Resilienz wirtschaftlicher Ökosysteme (CoyPu), Germany(grant numbers:01MK21007[A-L]); Leibniz Association in the program “Leibniz Best Minds: Programme for Women Professors,” Project TrustKG Transforming Data in Trustable Insights(grant numbers:P99/2020); ","https://ieeexplore.ieee.org/stamp/stamp.jsp?arnumber=9931124","Social media networks;community detection;post relatedness;knowledge graph;COVID-19;knowledge retrieval","Social networking (online);Information retrieval;Lung cancer;Unified modeling language;Training data;Knowledge management;Linear programming;COVID-19","","1","","76","CCBY","26 Oct 2022","2022","","IEEE","IEEE Journals"
