"Semantic Enrichment of Mobility Data: A Comprehensive Methodology and the MAT-BUILDER System","F. Lettich; C. Pugliese; C. Renso; F. Pinelli","ISTI, Consiglio Nazionale delle Ricerche, Pisa, Italy; ISTI, Consiglio Nazionale delle Ricerche, Pisa, Italy; ISTI, Consiglio Nazionale delle Ricerche, Pisa, Italy; SySMA Unit, IMT School for Advanced Studies, Lucca, Italy",IEEE Access,"31 Aug 2023","2023","11","","90857","90875","The widespread adoption of personal location devices, the Internet of Mobile Things, and Location Based Social Networks, enables the collection of vast amounts of movement data. This data often needs to be enriched with a variety of semantic dimensions, or aspects, that provide contextual and heterogeneous information about the surrounding environment, resulting in the creation of multiple aspect trajectories (MATs). Common examples of aspects can be points of interest, user photos, transportation means, weather conditions, social media posts, and many more. However, the literature does not currently provide a consensus on how to semantically enrich mobility data with aspects, particularly in dynamic scenarios where semantic information is extracted from numerous and heterogeneous external data sources. In this work, we aim to address this issue by presenting a comprehensive methodology to facilitate end users in instantiating their semantic enrichment processes of movement data. The methodology is agnostic to semantic aspects and external semantic data sources. The vision behind our methodology rests on three pillars: (1) three design principles which we argue are necessary for designing systems capable of instantiating arbitrary semantic enrichment processes; (2) the MAT-Builder system, which embodies these principles; (3) the use of an RDF knowledge graph-based representation to store MATs datasets, thereby enabling uniform querying and analysis of enriched movement data. We qualitatively evaluate the methodology in two complementary example scenarios, where we show both the potential in generating interesting and useful semantically enriched mobility datasets, and the expressive power in querying the resulting RDF trajectories with SPARQL.","2169-3536","","10.1109/ACCESS.2023.3307824","EC H2020 Projects MOBIDATALAB(grant numbers:101006879); MASTER(grant numbers:777695); Scheme “INFRAIA-01-2018-2019 through the Integrating Activities for Advanced Communities”(grant numbers:871042); “SoBigData++: European Integrated Infrastructure for Social Mining and Big Data Analytics” (https://www.sobigdata.eu); ","https://ieeexplore.ieee.org/stamp/stamp.jsp?arnumber=10227262","Multiple aspect trajectory;semantic enrichment;trajectory enrichment;semantic enrichment processing;knowledge graph;resource description framework;python","Trajectory;Semantics;Soft sensors;Meteorology;Tracking;Resource description framework;Social networking (online);Semantics;Knowledge graphs;Python","","7","","26","CCBYNCND","23 Aug 2023","2023","","IEEE","IEEE Journals"
"Hypergraph Neural Networks Based on Enclosing Subgraph Extraction for Temporal Link Prediction","Y. Zhao; X. Meng; L. Chen; J. Chen; A. Sajjanhar","College of Information Science and Technology, Beijing University of Chemical Technology, Beijing, China; College of Information Science and Technology, Beijing University of Chemical Technology, Beijing, China; College of Information Science and Technology, Beijing University of Chemical Technology, Beijing, China; Computer Center, Peking University, Beijing, China; School of Information Technology, Deakin University, Geelong, Australia",IEEE Access,"23 Sep 2025","2025","13","","163466","163480","The Graph Neural Network (GNN) methods based on enclosing subgraph extraction have achieved excellent results in static graph link prediction tasks. However, most real-world networks are dynamic and evolve over time; the traditional models cannot capture temporal evolution. Moreover, the existing temporal link prediction methods mainly use simple GNNs to learn spatial embeddings, which not only ignore the higher-order relationships and local clustering structures between nodes, but also perform poorly in static graph link prediction tasks. In order to address the above problems, we propose Hypergraph Neural Networks for Temporal Link Prediction(HGTLP), which is based on enclosing subgraph extraction. The proposed HGTLP constructs a hypergraph through enclosing subgraph extraction and dual hypergraph transformation to learn the higher-order spatial and temporal embeddings of each link to be predicted, and then combines the global knowledge of the collapsed graph to improve the prediction accuracy. Experimental results demonstrate that HGTLP achieves significant performance improvement compared to the state-of-the-art models in both link prediction and new link prediction tasks.","2169-3536","","10.1109/ACCESS.2025.3611308","","https://ieeexplore.ieee.org/stamp/stamp.jsp?arnumber=11168471","Collapsed graph;hypergraph;hypergraph neural network;link prediction;self-attention mechanism","Accuracy;Seals;Predictive models;Long short term memory;Transient analysis;Proteins;Message passing;Indexes;Data mining;Complex systems","","","","45","CCBY","17 Sep 2025","2025","","IEEE","IEEE Journals"
"Long Dialogue Emotion Detection Based on Commonsense Knowledge Graph Guidance","W. Nie; Y. Bao; Y. Zhao; A. Liu","School of Electrical and Information Engineering, Tianjin University, Tianjin, China; School of Electrical and Information Engineering, Tianjin University, Tianjin, China; School of Electrical and Information Engineering, Tianjin University, Tianjin, China; School of Electrical and Information Engineering, Tianjin University, Tianjin, China",IEEE Transactions on Multimedia,"8 Jan 2024","2024","26","","514","528","Dialogue emotion detection is always challenging due to human subjectivity and the randomness of dialogue content. In a conversation, the emotion of each person often develops via a cumulative process, which can be influenced by many elements of uncertainty. Much commonsense knowledge influences people's emotions imperceptibly, such as experiential or habitual knowledge. In the process of conversation, this commonsense knowledge information can be used to enrich the semantic information of each utterance and improve the accuracy of emotion recognition. In this paper, we propose a growing graph model for dialogues emotion detection based on retrieval of external knowledge atlas ATOMIC from local and global respectively, which can effectively represent the dialogues as a process variable in a sequence and the correlation among utterances also can be represented by the graph model. In particular, 1) we introduce a common sense knowledge graph for linking the commonsense knowledge retrieved from external knowledge atlas ATOMIC, which can effectively add auxiliary information to improve the performance of each utterance's representation. 2) We propose a novel self-supervised learning method for extracting the latent topic of each dialogue. Based on this design, we also propose an effective optimization mechanism to make the representation (embedding) of latent topic has a better distinction for the next operation. 3) Finally, the cross-attention module is utilized to combine the utterances' features and the latent conversation topic information. The attention mechanism can effectively use topic information to supplement the representation of utterances and improve recognition performance. The model is tested on three popular datasets in dialogue emotion detection and is empirically demonstrated to outperform the state-of-the-art approaches. Meanwhile, to demonstrate the performance of our approach, we also build a long dialogue dataset. The average length of each conversation is over 50 utterances. The final experimental results also demonstrate the superior performance of our approach.","1941-0077","","10.1109/TMM.2023.3267295","National Natural Science Foundation of China(grant numbers:62272337); National Archives Administration of China Science and Technology Project(grant numbers:2022-X-040); Science and Technology Project of China Huaneng Group Company Ltd.(grant numbers:HNKJ22-H156); ","https://ieeexplore.ieee.org/stamp/stamp.jsp?arnumber=10102573","Emotion detection;growing graph;commonsense knowledge graph;topic module","Emotion recognition;Commonsense reasoning;Oral communication;Correlation;Transformers;Speech recognition;Social networking (online)","","71","","73","IEEE","14 Apr 2023","2024","","IEEE","IEEE Journals"
"MMInfluencer: A Multimodal AI Framework for Influencer Marketing Tasks Using Large Language Models","J. Yang; D. Wang; L. Zhu; H. Yan; Q. Zhang","School of Information Management, Nanjing University, Nanjing, China; Division of Emerging Interdisciplinary Areas, The Hong Kong University of Science and Technology, Hong Kong SAR, China; Laboratory for AI-Powered Financial Technologies Ltd., Hong Kong SAR, China; Laboratory for AI-Powered Financial Technologies Ltd., Hong Kong SAR, China; Laboratory for AI-Powered Financial Technologies Ltd., Hong Kong SAR, China",IEEE Transactions on Computational Social Systems,"13 Feb 2026","2026","13","1","321","332","Influencer marketing involves brands partnering with influencers to promote products, often through combined text and image posts on social media platforms. This multimodal data is critical for identifying suitable products for effective marketing practice. In this study, we presented MMInfluencer, a novel framework that addressed the critical upstream challenge of knowledge extraction from unstructured multimodal social media data. Our framework operationalized communication theories, the heuristic-systematic model (HSM) and dual coding theory (DCT), to guide large language models (LLMs) in constructing a high-quality knowledge graph (KG) from the multimodal posts and biographies of 1000 Instagram influencers. Human assessment of the KG confirmed its relevance and completeness with accuracy scores of 0.89 and 0.75, respectively. We then examined the KG’s efficacy in various influencer marketing tasks using graph-based learning methods and retrieval-augmented generation (RAG) technology. The KG derived from multimodal data significantly improved product category prediction and recommendation tasks, with the Node2Vec model showing improvements of 20.47% (AUROC, p $<$ 0.0001) and 1142.15% (NDCG@20, p $<$ 0.0001), respectively. In contrast, the RAG method was ineffective, yielding an accuracy of just 0.1195 ($\pm$ 0.0162). Furthermore, the LLM-extracted KG significantly improved performance in challenging scenarios, where the best model achieved improvements of 155.51% (NDCG@20, p $=$ 0.0170) for emerging influencers (zero-shot) and 1144.51% (NDCG@20, p $<$ 0.0001) for influencers with scarce data (cold-start). Our research underscores the potential of leveraging multimodal data, LLMs, and graph-based learning methods for effective influencer marketing.","2329-924X","","10.1109/TCSS.2025.3597544","InnoHK Initiative; The Government of the HKSAR; Laboratory for AI-Powered Financial Technologies; ","https://ieeexplore.ieee.org/stamp/stamp.jsp?arnumber=11151670","Cold-start recommendation;influencer marketing;knowledge graph (KG);large language model (LLM);multimodal;zero-shot recommendation","Social networking (online);Recommender systems;Large language models;Discrete cosine transforms;Web sites;Visualization;Semantics;Knowledge graphs;Fintech;Data models","","","","75","IEEE","4 Sep 2025","Feb. 2026","","IEEE","IEEE Journals"
"MVAN: Multi-View Attention Networks for Fake News Detection on Social Media","S. Ni; J. Li; H. -Y. Kao","Department of Computer Science and Information Engineering, National Cheng Kung University, Tainan, Taiwan; Department of Computer Science and Information Engineering, National Cheng Kung University, Tainan, Taiwan; Department of Computer Science and Information Engineering, National Cheng Kung University, Tainan, Taiwan",IEEE Access,"4 Aug 2021","2021","9","","106907","106917","Fake news on social media is a widespread and serious problem in today's society. Existing fake news detection methods focus on finding clues from Long text content, such as original news articles and user comments. This paper solves the problem of fake news detection in more realistic scenarios. Only source shot-text tweet and its retweet users are provided without user comments. We develop a novel neural network based model, Multi-View Attention Networks (MVAN) to detect fake news and provide explanations on social media. The MVAN model includes text semantic attention and propagation structure attention, which ensures that our model can capture information and clues both of source tweet content and propagation structure. In addition, the two attention mechanisms in the model can find key clue words in fake news texts and suspicious users in the propagation structure. We conduct experiments on two real-world datasets, and the results demonstrate that MVAN can significantly outperform state-of-the-art methods by 2.5% in accuracy on average, and produce a reasonable explanation.","2169-3536","","10.1109/ACCESS.2021.3100245","Qualcomm through the Taiwan University Research Collaboration Project; Ministry of Science and Technology, Taiwan(grant numbers:109-2221-E-006-173,NCKU B109-K027D); ","https://ieeexplore.ieee.org/stamp/stamp.jsp?arnumber=9497048","Fake news detection;graph attention networks;attention;deep learning;social media","Social networking (online);Feature extraction;Deep learning;Blogs;Neural networks;Mathematical model;Logic gates","","102","","46","CCBY","26 Jul 2021","2021","","IEEE","IEEE Journals"
"Cross-Domain Knowledge Graph Chiasmal Embedding for Multi-Domain Item-Item Recommendation","J. Liu; W. Huang; T. Li; S. Ji; J. Zhang","Institute of Artificial Intelligence, School of Computing and Artificial Intelligence, Southwest Jiaotong University, Chengdu, China; Institute of Artificial Intelligence, School of Computing and Artificial Intelligence, Southwest Jiaotong University, Chengdu, China; Institute of Artificial Intelligence, School of Computing and Artificial Intelligence, Southwest Jiaotong University, Chengdu, China; Tencent Inc., Shenzhen, China; JD Intelligent Cities Research, China & JD iCity, JD Tech, Beijing, China",IEEE Transactions on Knowledge and Data Engineering,"3 Apr 2023","2023","35","5","4621","4633","Recommender system can provide users with the required information accurately and efficiently, playing a very important role in improving users’ life experience. Although knowledge graph-based recommender system can solve the sparsity and cold start problems faced by traditional recommender system, it cannot handle the cross-domain cold start problem and cannot provide multi-domain recommendations. Therefore, this paper focuses on multi-domain item-item (I2I) recommendation based on cross-domain knowledge graph embedding by analyzing the association between items of the same domain and the interaction between items of diverse domains with the aid of knowledge graph that contains rich information. First, a cross-domain knowledge graph chiasmal embedding approach is proposed to efficiently interact all items in multiple domains. To help achieve both homo-domain embedding and hetero-domain embedding of items, a binding rule is put forward. Second, a multi-domain I2I recommendation method is presented to efficiently recommend items in multiple domains, which is a recommendation method based on link prediction of knowledge graph. Finally, the proposed methods are compared and analyzed with some benchmark methods using two datasets. The experimental results show that the proposed methods achieve better link prediction results and multi-domain recommendation results.","1558-2191","","10.1109/TKDE.2022.3151986","National Key R&D Program of China(grant numbers:2019YFB2101802); National Natural Science Foundation of China(grant numbers:61773324); ","https://ieeexplore.ieee.org/stamp/stamp.jsp?arnumber=9714871","Recommender system;multi-domain recommendation;item-item recommendation;knowledge graph embedding","Knowledge engineering;Recommender systems;Task analysis;Social networking (online);Motion pictures;Feature extraction;Semantics","","28","","50","IEEE","16 Feb 2022","1 May 2023","","IEEE","IEEE Journals"
"Identifying Hot Topic Trends in Streaming Text Data Using News Sequential Evolution Model Based on Distributed Representations","Z. A. Khan; Y. Xia; S. Ali; J. A. Khan; S. S. Askar; M. Abouhawwash; N. El-Rashidy","School of Automation, Beijing Institute of Technology, Beijing, China; School of Automation, Beijing Institute of Technology, Beijing, China; School of Automation, Beijing Institute of Technology, Beijing, China; Department of Computer Science, Faculty of Physics, Engineering, and Computer Science, University of Hertfordshire, Hatfield, U.K.; Department of Statistics and Operation Research, College of Science, King Saud University, Riyadh, Saudi Arabia; Department of Computational Mathematics, Science, and Engineering (CMSE), Michigan State University, East Lansing, MI, USA; Machine Learning and Information Retrieval Department, Faculty of Artificial Intelligence, Kafrelsheikh University, Kafr El-Sheikh, Egypt",IEEE Access,"14 Sep 2023","2023","11","","98787","98804","Hot topic trends have become increasingly important in the era of social media, as these trends can spread rapidly through online platforms and significantly impact public discourse and behavior. As a result, the scope of distributed representations has expanded in machine learning and natural language processing. As these approaches can be used to effectively identify and analyze hot topic trends in large datasets. However, previous research has shown that analyzing sequential periods in data streams to detect hot topic trends can be challenging, particularly when dealing with large datasets. Moreover, existing methods often fail to accurately capture the semantic relationships between words over different time periods, limiting their effectiveness in trend prediction and relationship analysis. This paper aims to utilize a distributed representations approach to detect hot topic trends in streaming text data. For this purpose, we build a sequential evolution model for a streaming news website to identify hot topic trends in streaming text data. Additionally, we create a visual display model and knowledge graph to further enhance our proposed approach. To achieve this, we begin by collecting streaming news data from the web and dividing it chronologically into several datasets. In addition, word2vec models are built in different periods for each dataset. Finally, we compare the relationship of any target word in sequential word2vec models and analyze its evolutionary process. Experimental results show that the proposed method can detect hot topic trends and provide a graphical representation of any raw data that cannot be easily designed using traditional methods.","2169-3536","","10.1109/ACCESS.2023.3312764","King Saud University, Riyadh, Saudi Arabia. Researchers Supporting Project(grant numbers:RSP2023R167); ","https://ieeexplore.ieee.org/stamp/stamp.jsp?arnumber=10243000","Topic trends;news sequential evolution model;stream text analysis;visual display model;knowledge graph;distributed representations","Market research;Analytical models;Data models;Distributed databases;Social networking (online);Knowledge graphs;Semantics;Sequences;Text analysis","","13","","42","CCBYNCND","7 Sep 2023","2023","","IEEE","IEEE Journals"
"Empowering Semantic Segmentation With Selective Frequency Enhancement and Attention Mechanism for Tampering Detection","X. Xu; W. Lv; W. Wang; Y. Zhang; J. Chen","School of Software, Dalian University of Technology, Dalian, China; School of Computer Science and Engineering, Northeastern University, Shenyang, China; Guangdong-Hong Kong-Macao Joint Laboratory for Emotion Intelligence and Pervasive Computing, Artificial Intelligence Research Institute, Shenzhen MSU-BIT University, Shenzhen, China; College of Computer Science and Technology, Nanjing University of Aeronautics and Astronautics, Nanjing, China; School of Software, Dalian University of Technology, Dalian, China",IEEE Transactions on Artificial Intelligence,"25 Jun 2024","2024","5","6","3270","3283","Nowadays, massive amounts of multimedia contents are exchanged in our daily life, while tampered images are also flooding the social networks. Tampering detection is therefore becoming increasingly important for multimedia integrity, and it is generally realized by designing specific convolutional neural networks. From a new perspective, this article proposes two pluggable modules for empowering existing semantic segmentation models for tampering detection. First, a selective frequency enhancement (SFE) module is developed to suppress the semantic information and selectively enhance the tamper information. Second, a boundary enhanced attention (BEA) module is designed to highlight the edge information of tempered area. Our SFE and BEA modules are combined with five mainstream semantic segmentation networks for performance evaluation. The experiment results demonstrate that our modules are able to empower the semantic segmentation networks for tampering detection, and their combinations even perform better than state-of-the-art algorithms in certain datasets.","2691-4581","","10.1109/TAI.2023.3347178","National Natural Science Foundation of China(grant numbers:62171114); Fundamental Research Funds for the Central Universities(grant numbers:DUT22RC(3)099); Xiaomi Young Talents Program; ","https://ieeexplore.ieee.org/stamp/stamp.jsp?arnumber=10374367","Convolutional neural networks;image forensics;image tampering detection;semantic segmentation","Semantic segmentation;Forgery;Image edge detection;Social networking (online);Semantics;Discrete cosine transforms;Splicing","","13","","64","IEEE","26 Dec 2023","June 2024","","IEEE","IEEE Journals"
"Abstractive Multi-Document Summarization Based on Semantic Link Network","W. Li; H. Zhuge","Institute of Computing Technology, Chinese Academy of Sciences, Beijing, China; Key Lab of Intelligent Information Processing at the Institute of Computing Technology in Chinese Academy of Sciences, Systems Analytics Research Institute at Aston University, International Research Network on Cyber-Physical-Social Intelligence consisting of Guangzhou University, University of Chinese Academy of Sciences, Beijing, China",IEEE Transactions on Knowledge and Data Engineering,"7 Dec 2020","2021","33","1","43","54","The key to realize advanced document summarization is semantic representation of documents. This paper investigates the role of Semantic Link Network in representing and understanding documents for multi-document summarization. It proposes a novel abstractive multi-document summarization framework by first transforming documents into a Semantic Link Network of concepts and events and then transforming the Semantic Link Network into the summary of the documents based on the selection of important concepts and events while keeping semantics coherence. Experiments on benchmark datasets show that the proposed summarization approach significantly outperforms relevant state-of-the-art baselines and the Semantic Link Network plays an important role in representing and understanding documents.","1558-2191","","10.1109/TKDE.2019.2922957","National Natural Science Foundation of China(grant numbers:61876048); ","https://ieeexplore.ieee.org/stamp/stamp.jsp?arnumber=8736808","Abstractive summarization;information extraction;multi-document summarization;semantic link network","Semantics;Data mining;Coherence;Security;Feature extraction;Syntactics;Benchmark testing","","32","","66","IEEE","14 Jun 2019","1 Jan. 2021","","IEEE","IEEE Journals"
