"Document Title",Authors,"Author Affiliations","Publication Title",Date Added To Xplore,"Publication Year","Volume","Issue","Start Page","End Page","Abstract","ISSN",ISBNs,"DOI",Funding Information,PDF Link,"Author Keywords","IEEE Terms","Mesh_Terms",Article Citation Count,Patent Citation Count,"Reference Count","License",Online Date,Issue Date,"Meeting Date","Publisher",Document Identifier
"Uncovering Hidden Social Connections in Lawsuit Activities by Learning Over Knowledge Graph","Z. Liang; Y. Lian; C. Ding; Y. Yang","City University of Hong Kong, Hong Kong, China; City University of Hong Kong, Hong Kong, China; School of Law, City University of Hong Kong, Hong Kong, China; Department of Data Science, City University of Hong Kong, Hong Kong, China",IEEE Transactions on Computational Social Systems,"2 Apr 2026","2026","13","2","1976","1988","While frequent lawsuits against businesses for claiming excessive damages have negative impacts on the economy, lawsuits may be strategically employed to improve law enforcement and social governance. Chinese consumer citizen suits are an example of such, although their patterns and impacts remain a mystery. This work constructs a comprehensive knowledge graph (KG) from judicial decisions and employs transformer-based heterogeneous graph neural networks (HGNNs) to analyze the behavioral patterns of plaintiffs. By leveraging deep contextual features from the KG, this study uncovers hidden social relationships among plaintiffs, revealing organized litigation behaviors facilitated by shared legal resources, such as lawyers, law offices, and common defendants. To the best of our knowledge, this is the first empirical study to uncover and validate hidden social connections among consumer-plaintiffs in China using a KG and a transformer-based HGNN framework. The findings reveal significant community structures, indicating that plaintiffs may frequently act in organized groups in lawsuit activities. This study advances methodological approaches by integrating HGNNs for link prediction and modularity-based community detection, offering actionable insights into the dynamics of grassroots litigation. By introducing a novel analytical framework and dataset, this work deepens the understanding of consumer lawsuits, underscores the influence of social networks on litigation behavior, and lays a foundation for future research in legal analytics and social network analysis (SNA) within the legal domain.","2329-924X","","10.1109/TCSS.2025.3606552","Hong Kong Special Administrative Region, China(grant numbers:CityU 11601019); CityU Research Project(grant numbers:9220184); ","https://ieeexplore.ieee.org/stamp/stamp.jsp?arnumber=11196984","Consumer citizen suits;heterogeneous graph neural networks (HGNNs);knowledge graph (KG);social network analysis (SNA);social relation","Law;Social networking (online);Deep learning;Urban areas;Knowledge graphs;Transformers;Pipelines;Data mining;Sparse matrices;Social dynamics","","","","37","IEEE","8 Oct 2025","April 2026","","IEEE","IEEE Journals"
"An Efficient Rumor Suppression Approach With Knowledge Graph Convolutional Network in Social Network","F. Gao; Q. He; X. Wang; L. Qiu; M. Huang","College of Computer Science and Engineering, Northeastern University, Shenyang, China; College of Medicine and Biological Information Engineering, Northeastern University, Shenyang, China; College of Computer Science and Engineering, Northeastern University, Shenyang, China; College of Computer Science and Engineering, Northeastern University, Shenyang, China; College of Information Science and Engineering, Northeastern University, Shenyang, China",IEEE Transactions on Computational Social Systems,"2 Oct 2024","2024","11","5","6254","6267","Social networks currently serve as one of the primary sources from which people obtain news, with the spread of rumors emerging as a major concern. The goal of rumor suppression is to minimize the number of individuals affected by rumors through various methods, such as blocking and disseminating the truth. Although this problem has evolved into a popular research topic, existing solutions often overlook the temporal impact of rumor-refuting information and the influence of user opinions on rumor spreading. In the study, we first investigate the two-stage rumor minimization problem. The problem primarily considers two situations about only the propagation of rumors and the simultaneous propagation of rumor and rumor-refuting information, aiming to minimize the impact of rumors. We propose the two-stage user opinion rumor propagation model (TSUORP), which fully incorporates the timing of official releases of rumor-refuting information and their influence on the generation of rumors propagation. Based on this, we propose an approach using the knowledge graph convolutional network (KGCN) algorithm to rapidly and effectively select rumor-refuting information seed nodes based on user opinions. To assess the validity of our proposed approach, we perform experiments on three authentic datasets, showcasing its notable advantages.","2329-924X","","10.1109/TCSS.2024.3383493","National Natural Science Foundation of China(grant numbers:62032013,62202089,92267206); ","https://ieeexplore.ieee.org/stamp/stamp.jsp?arnumber=10506844","Knowledge graph convolutional network (KGCN);rumor suppression;social network;two stage","Social networking (online);Integrated circuit modeling;Knowledge graphs;Computational modeling;Heuristic algorithms;Fake news;Psychology","","17","","45","IEEE","23 Apr 2024","Oct. 2024","","IEEE","IEEE Journals"
"Topic-Specific Political Stance Inference in Social Networks With Case Studies","K. Wu; Y. Zhou; J. Ma; X. Guo","School of Resources and Environment, University of Electronic Science and Technology of China, Chengdu, China; Shenzhen CyberAray Network Technology Company Ltd., Shenzhen, China; Shenzhen CyberAray Network Technology Company Ltd., Shenzhen, China; Shenzhen CyberAray Network Technology Company Ltd., Shenzhen, China",IEEE Access,"15 Feb 2024","2024","12","","21921","21935","Topic-specific political stance inference in social networks (SNs) aims at inferring target users’ attitudes toward different target topics. Traditional methods mainly used a language model to classify sentiments from the postings of the SN users. However, people’s stances are not always equal to their sentiments. Some others tried to build separate models toward different target topics. In many cases, though SN users talked about the target topics, the information given was limited; or they only expressed attitudes toward some other issues except the target topics. When information is incomplete, the methods that treat the topics independently fail to work, let alone for users who didn’t post any of the topics. To solve the above problems, we introduced a political knowledge graph (PKG) to supplement side information for users and topics and proposed a united Knowledge Graph-aware and Social Network-enhanced framework (KGSN) to capture not only the knowledge connections between topics but also the social connections between users. KGSN utilized two levels of graph convolutional networks, the one at the knowledge graph level generating knowledge-aware representations merging knowledge entities for the users and topics respectively, and the one at the social graph level generating social-enhanced representations merging social neighbors for the target users. Beyond that, the respective topic-specific attention mechanisms were leveraged to emphasize special knowledge entities in the knowledge graph and special neighboring users in the social graph. The advantages of KGSN are that: first, it can infer users’ attitudes toward more than one topic in one model; second, it can infer users’ implicit attitudes toward the target topics through users’ explicit attitudes toward the other issues; last but not least, even for users without any postings, KGSN can infer users’ implicit attitudes through their social neighbors. Finally, extensive experiments were conducted to demonstrate the superiority of KGSN over state-of-the-art models and case studies were investigated to testify the effectiveness of the model.","2169-3536","","10.1109/ACCESS.2024.3360487","","https://ieeexplore.ieee.org/stamp/stamp.jsp?arnumber=10428937","Graph neural networks;knowledge graph;political stance inference;social networks","Social networking (online);Knowledge graphs;Blogs;Knowledge engineering;Training;Solid modeling;Knowledge based systems;Graph neural networks;Government","","2","","49","CCBYNCND","8 Feb 2024","2024","","IEEE","IEEE Journals"
"Analysis and Mining of Internet Public Opinion Based on LDA Subject Classification","M. Zhang; H. Su; J. Wen","Information Institute, Guizhou University of Financial and Economics, Guiyang, Guizhou, China; Information Institute, Guizhou University of Financial and Economics, Guiyang, Guizhou, China; Information Institute, Guizhou University of Financial and Economics, Guiyang, Guizhou, China",Journal of Web Engineering,"22 Sep 2023","2021","20","8","2457","2472","This paper uses Python, R language, Gephi and other software to crawl and classify the comment content of Weibo hot search events. Using word cloud, co-occurrence social network graphs, LDA topic classification visualization methods, this paper regularizes and integrates public opinions of hot events. Through this research, we can get the influence of public opinion mediators, public opinion objects, and government forces on the network public opinion and put forward corresponding improvement suggestions. We hope to contribute to the government's governance and prevention of online public opinion during the spread of COVID-19 and other public hot events.","1544-5976","","10.13052/jwe1540-9589.20811","Guizhou University of Finance and Economics(grant numbers:2019XZD02); ","https://ieeexplore.ieee.org/stamp/stamp.jsp?arnumber=10246839","Online public opinion;LDA;co-occurrence knowledge graphs;visualization","COVID-19;R language;Social networking (online);Government;Blogs;Sociology;Tag clouds","","4","","13","","22 Sep 2023","November 2021","","River Publishers","River Publishers Journals"
"Graph Convolutional Network-Based Interest Recommendation in the Social Internet of Things With Sparse Social Interaction","H. Lan; J. Huang; M. Liu; F. Yang; W. Jiang; D. Niyato","School of Electrical and Electronic Engineering, Chongqing University of Technology, Chongqing, China; School of Electrical and Electronic Engineering, Chongqing University of Technology, Chongqing, China; School of Electrical and Electronic Engineering, Chongqing University of Technology, Chongqing, China; School of Electrical and Electronic Engineering, Chongqing University of Technology, Chongqing, China; School of Microelectronics and Communication Engineering, Chongqing University, Chongqing, China; School of Computer Science and Engineering, Nanyang Technological University, Jurong West, Singapore",IEEE Internet of Things Journal,"25 Mar 2026","2026","13","7","15067","15078","With the emergence of information overload in the Social Internet of Things (SIoT), personalized recommender systems (RSs) have become essential for helping users locate the items they need. Effectively modeling the heterogeneous relationships across multiple information sources and weighting them according to their varying importance, especially under sparse social interactions in the SIoT, remains a key challenge. To address this issue, this article proposes a multisource adaptive relational graph convolutional network (MARGCN) framework for RSs. User–user and user–item interactions are modeled as two relational graphs, and their embedded features are aggregated using graph convolutional networks (GCNs). A multisource relationship perception model is designed to dynamically perceive and measure the importance of multiple relationships within the graph structure, thereby enhancing the ability to recognize heterogeneous information. An adaptive information fusion model is then constructed to dynamically integrate representations from different sources through a learnable fusion strategy, avoiding information loss or redundancy caused by simple weighting. Users and items are ultimately represented by aggregating and updating their embeddings via GCNs. Experiments show that compared with the most advanced methods, MARGCN improves the hit ratio (HR) and the normalized discounted cumulative gain (NDCG) by 2.66%, 0.52%, and 3.93% in HR@5, HR@10, and HR@15, and by 1.58%, 1.32%, and 3.14% in NDCG@5, NDCG@10, and NDCG@15, respectively.","2327-4662","","10.1109/JIOT.2026.3652468","National Natural Science Foundation of China(grant numbers:62301094); Science and Technology Research Program of Chongqing Education Commission of China(grant numbers:KJQN202301135); Cultivation Program of Scientific Research and Innovation Team of Chongqing University of Technology(grant numbers:2023TDZ003); Science and Technology Innovation Key Research and Development Program of Chongqing(grant numbers:CSTB2024TIAD-STX0034); ","https://ieeexplore.ieee.org/stamp/stamp.jsp?arnumber=11343829","Adaptive information fusion;data sparsity;graph neural network (GNN);multisource relationship;recommender systems (RSs)","Social Internet of Things;Adaptation models;Recommender systems;Adaptive systems;Data models;Social networking (online);Graph convolutional networks;Accuracy;Knowledge graphs;Feature extraction","","","","69","IEEE","12 Jan 2026","1 April1, 2026","","IEEE","IEEE Journals"
"Networked Knowledge and Complex Networks: An Engineering View","J. Lü; G. Wen; R. Lu; Y. Wang; S. Zhang","School of Automation Science and Electrical Engineering, State Key Laboratory of Software Development Environment, Beihang University, Beijing, China; Department of Systems Science, School of Mathematics, Southeast University, Nanjing, China; Academy of Mathematics and Systems Science, Chinese Academy of Sciences, Beijing, China; Academy of Mathematics and Systems Science, Chinese Academy of Sciences, Beijing, China; Academy of Mathematics and Systems Science, Chinese Academy of Sciences, Beijing, China",IEEE/CAA Journal of Automatica Sinica,"3 Aug 2022","2022","9","8","1366","1383","Along with the development of information technologies such as mobile Internet, information acquisition technology, cloud computing and big data technology, the traditional knowledge engineering and knowledge-based software engineering have undergone fundamental changes where the network plays an increasingly important role. Within this context, it is required to develop new methodologies as well as technical tools for network-based knowledge representation, knowledge services and knowledge engineering. Obviously, the term “network” has different meanings in different scenarios. Meanwhile, some breakthroughs in several bottleneck problems of complex networks promote the developments of the new methodologies and technical tools for network-based knowledge representation, knowledge services and knowledge engineering. This paper first reviews some recent advances on complex networks, and then, in conjunction with knowledge graph, proposes a framework of networked knowledge which models knowledge and its relationships with the perspective of complex networks. For the unique advantages of deep learning in acquiring and processing knowledge, this paper reviews its development and emphasizes the role that it played in the development of knowledge engineering. Finally, some challenges and further trends are discussed.","2329-9274","","10.1109/JAS.2022.105737","National Natural Science Foundation of China(grant numbers:61621003,62073079,62088101,12025107,11871463,11688101); ","https://ieeexplore.ieee.org/stamp/stamp.jsp?arnumber=9849163","Complex network;knowledge graph;networked knowledge;neural network","Knowledge engineering;Social networking (online);Evolution (biology);Semantics;Knowledge based systems;Complex networks;Knowledge representation","","44","","177","","3 Aug 2022","August 2022","","IEEE","IEEE Journals"
"Joint Modeling of Multimodal Information Based on Dynamic and Static Knowledge Graphs for Next POI Recommendation","X. Sun; Z. Gao; D. Yu; B. Huang","Hangzhou Dianzi University, Hangzhou, China; Hangzhou Dianzi University, Hangzhou, China; Hangzhou Dianzi University, Hangzhou, China; Hangzhou Dianzi University, Hangzhou, China",IEEE Transactions on Computational Social Systems,"2 Dec 2025","2025","12","6","3985","3999","As one of the location-based social network (LBSN) applications, next point-of-interest (POI) recommendation is devoted to predicting a user’s next interested locations based on check-in trajectories, which has received a lot of attention. In recent research endeavors, graph neural network (GNN) has demonstrated exceptional performance by incorporating global user/POI features into the learning framework. Nevertheless, most existing approaches merely target on one or two factors present in trajectories, such as geographic location, social networks, or user reviews, failing to fully exploit the multimodal information in real-world scenarios. Additionally, user’s behavior patterns embedded in historical trajectories have not been effectively partitioned, posing challenges to the learning of user’s evolving preferences over time. To this end, this study proposes multimodal intertwined network (MINet), a novel model based on dynamic and static knowledge graphs, to tackle the challenges of multimodality in the next POI recommendation. On the one hand, temporal dynamic knowledge graph is established to learn the evolution of user preferences by capturing behavior patterns at various time slices. On the other hand, a grouping static knowledge graph is constructed to learn the stable user/POI features through aggregating multimodal relations. Furthermore, to achieve enhanced information fusion, this study learns the features of POIs and users from the two types of knowledge graphs, respectively. Experiments on three real-world datasets demonstrated that MINet outperforms the state-of-the-art methods.","2329-924X","","10.1109/TCSS.2025.3567512","National Natural Science Foundation of China(grant numbers:61472112); Natural Science Foundation of Zhejiang Province(grant numbers:LQ20F020017); Key Science and Technology Project of Zhejiang(grant numbers:2020C01165,2021C01031); ","https://ieeexplore.ieee.org/stamp/stamp.jsp?arnumber=11037649","Next POI recommendation;point-of-interest (POI);static knowledge graph (SKG);temporal knowledge graph","Knowledge graphs;Trajectory;Reviews;Predictive models;Transformers;Social networking (online);Graph neural networks;Feature extraction;Recommender systems","","4","","61","IEEE","17 Jun 2025","Dec. 2025","","IEEE","IEEE Journals"
"Toward a Cognitive-Inspired Hashtag Recommendation for Twitter Data Analysis","Y. Djenouri; A. Belhadi; G. Srivastava; J. C. -W. Lin","SINTEF Digital, Oslo, Norway; School of Economics, Innovation and Technology, Kristiania University College, Oslo, Norway; Department of Mathematics and Computer Science, Brandon University, Brandon, MB, Canada; Department of Computer Science, Electrical Engineering and Mathematical Sciences, Western Norway University of Applied Sciences, Bergen, Norway",IEEE Transactions on Computational Social Systems,"30 Nov 2022","2022","9","6","1748","1757","This research investigates hashtag suggestions in a heterogeneous and huge social network, as well as a cognitive-based deep learning solution based on distributed knowledge graphs. Community detection is first performed to find the connected communities in a vast and heterogeneous social network. The knowledge graph is subsequently generated for each discovered community, with an emphasis on expressing the semantic relationships among the Twitter platform’s user communities. Each community is trained with the embedded deep learning model. To recommend hashtags for the new user in the social network, the correlation between the tweets of such user and the knowledge graph of each community is explored to set the relevant communities of such user. The models of the relevant communities are used to infer the hashtags of the tweets of such users. We conducted extensive testing to demonstrate the usefulness of our methods on a variety of tweet collections. Experimental results show that the proposed approach is more efficient than the baseline approaches in terms of both runtime and accuracy.","2329-924X","","10.1109/TCSS.2022.3169838","","https://ieeexplore.ieee.org/stamp/stamp.jsp?arnumber=9771087","Cognitive computing;deep learning;hashtag recommendation;semantic analysis;social network","Social networking (online);Deep learning;Blogs;Semantics;Knowledge engineering;Feature extraction","","16","","41","IEEE","9 May 2022","Dec. 2022","","IEEE","IEEE Journals"
"Contrastive Multi-Knowledge Graph Learning for Fake News Detection","B. Xie; X. Ma; S. Xue; J. Yang; J. Wu; H. Fan","School of Information Management, Wuhan University, Wuhan, China; School of Computing, Macquarie University, Sydney, NSW, Australia; School of Computing, Macquarie University, Sydney, NSW, Australia; School of Computing, Macquarie University, Sydney, NSW, Australia; School of Computing, Macquarie University, Sydney, NSW, Australia; School of Information Management, Wuhan University, Wuhan, China",IEEE Transactions on Network Science and Engineering,"22 Aug 2025","2025","12","5","3948","3961","The widespread dissemination of fake news on social media platforms has significantly disrupted people's daily lives, causing substantial inconvenience and loss. Although fake news detection has captivated great research effort, most of the existing works either overlook the complementary ground knowledge, formulated in individual knowledge graphs (KGs) or ignore multiple aspects of knowledge in different knowledge graphs. In this paper, we propose a novel contrastive learning framework for investigating the complementary knowledge in different knowledge graphs, which achieves superior fake news detection performance. We first model three components within news articles (i.e., news content, entities, and topics) as a heterogeneous graph (HG). Subsequently, we leverage the valuable factual evidence among real-world entities, which is enclosed in two open-source knowledge graphs (Wikidata and DBpedia), and augment the heterogeneous graph into three augmented graphs. We then fuse knowledge-enhanced high-level news representations from each augmented graph and extract a unified news representation through our proposed contrastive multi-knowledge graph learning framework, which is ultimately utilized to identify fake news. We conduct extensive experiments on four public fake news datasets and demonstrate the superiority of our method over nine state-of-the-art baselines regarding five widely-used evaluation metrics (i.e., accuracy, precision, recall, F1-score, and ROC).","2327-4697","","10.1109/TNSE.2025.3567296","National Natural Science Foundation of China(grant numbers:72474160,72374161); Australian Research Council(grant numbers:DP230100899); Macquarie University Data Horizons Research Centre and Applied Artificial Intelligence Centre; ","https://ieeexplore.ieee.org/stamp/stamp.jsp?arnumber=10989578","Fake news detection;anomaly detection;knowledge graph;graph neural networks (GNNs);contrastive learning","Fake news;Knowledge graphs;Social networking (online);Contrastive learning;Semantics;COVID-19;Translation;Training;Feature extraction","","7","","67","IEEE","6 May 2025","Sept.-Oct. 2025","","IEEE","IEEE Journals"
