"MgSAN: Multi-Graph Semantic-Aware Adaptive Graph Convolutional Network for Fake News Detection","L. Zhu; L. He; H. Sun; Q. Zhang","School of Xi’an Jiaotong University, Xi’an, China; School of Xi’an Jiaotong University, Xi’an, China; School of Xi’an Jiaotong University, Xi’an, China; School of Xi’an Jiaotong University, Xi’an, China",IEEE Transactions on Knowledge and Data Engineering,"10 Apr 2026","2026","38","5","2954","2967","The widespread dissemination and misleading impact of fake news on the web have become a significant concern for the public and the government. Discovering fake news is crucial for ensuring that users receive authentic information and maintaining social harmony. However, most existing entity-based fake news detection methods have two issues: i) methods for acquiring additional information through entities lack flexibility and real-time capabilities. ii) approaches using entities to capture news semantics have not adequately revealed the interactions between words in the text. To address these issues, we propose a Multi-graph Semantic-aware Adaptive Graph Convolutional Network (MgSAN), which comprehensively captures the semantic information of news texts by constructing multiple semantic graphs and learns the features from these graph structures using an adaptive graph convolutional network (SwiGCN). Specifically, we design a global semantic interaction graph to capture the complex interactions between words, generating a comprehensive textual semantic representation. We also employ an entity-noun relationship graph to mine deep semantic associations, enhancing the model’s understanding of fine-grained textual deep meanings. Additionally, we develop an adaptive graph convolutional network to effectively extract and aggregate feature information from different graph structures. Finally, we introduce a fusion module to integrate both global and local fine-grained semantic information, forming a rich composite semantic representation, thereby improving the effectiveness of fake news detection. Extensive experimental results on three public benchmark datasets verify the effectiveness and superior performance of MgSAN, outperforming state-of-the-art detection models.","1558-2191","","10.1109/TKDE.2026.3666727","National Science Foundation of China(grant numbers:62472348); Xianyang Major Scientific and Technological Achievements Transformation Special Project(grant numbers:L2024-ZDKJ-ZDCGZH-0012); Key Research and Development Program of Shaanxi(grant numbers:2024GX-YBXM-533); Service Local Special Plan Project of the Education Department of Shaanxi Province(grant numbers:HTXZ202512230592); Sichuan Science and Technology Program(grant numbers:2025ZNSFSC0468); ","https://ieeexplore.ieee.org/stamp/stamp.jsp?arnumber=11403966","Fake news detection;multi-graph semantic-aware;adaptive graph convolutional network","Semantics;Fake news;Graph convolutional networks;Adaptation models;Feature extraction;Adaptive systems;Social networking (online);Knowledge graphs;Transformers;Real-time systems","","1","","58","IEEE","20 Feb 2026","May 2026","","IEEE","IEEE Journals"
"Disentangling Political Bias in Social Media Data Through Multitask Embedding Learning","Y. Zhang; T. Hara; L. Yao","Graduate School of Information Science and Technology, The University of Osaka, Osaka, Japan; Graduate School of Information Science and Technology, The University of Osaka, Osaka, Japan; School of Computer Science and Engineering, University of New South Wales, Kensington, NSW, Australia",IEEE Transactions on Computational Social Systems,"13 Feb 2026","2026","13","1","196","207","Socialmedia is an important information source for understanding community events, personal communications, and other social activities. Therefore, mining information from social media data has been widely studied. Recently, it has been shown that knowledge graphs constructed from social media data can be effectively mined, which usually results in embeddings that contain structural information about social media entities. However, it has been shown that embeddings learned from social media data can contain social bias. Bias in the embedding is usually considered as undesirable, but there is only limited number of works that can separate bias from the embedding. In this article, we propose a bias disentanglement model that separates embedding into two parts, one preserves general information but has bias removed, and the other contains distilled bias. The two sets of embeddings can be used for computational tasks with different information requirements. Our method, disentangling bias through multitask embedding learning (DisMEL), is based on knowledge graph embedding techniques and supervised disentangling models. In addition to qualitative analysis of the generated embeddings, we test our method in two downstream tasks, namely, user political bias prediction and tweet recommendation. We compare our method with several baseline methods in experimental evaluations, based on a large-scale Japanese political social media dataset we collected and prepared. We show that when the debiased embedding set is used, the tasks irrelevant to political bias can be improved. On the other hand, when the biased embedding set is used, the tasks relevant to political bias can be improved. While we deal with political bias in this article, our method can also be adopted for other kinds of bias, such as gender or ethnicity bias.","2329-924X","","10.1109/TCSS.2025.3576342","","https://ieeexplore.ieee.org/stamp/stamp.jsp?arnumber=11080285","Embedding debiasing;embedding disentanglement;political bias","Social networking (online);Dictionaries;Knowledge graphs;Manuals;Data mining;Blogs;Semantics;Inference algorithms;Hands;Computational modeling","","","","55","IEEE","15 Jul 2025","Feb. 2026","","IEEE","IEEE Journals"
"A Survey of Large Language Models on Generative Graph Analytics: Query, Learning, and Applications","W. Shang; X. Huang","Department of Computer Science, Hong Kong Baptist University, Hong Kong; Department of Computer Science, Hong Kong Baptist University, Hong Kong",IEEE Transactions on Knowledge and Data Engineering,"7 Nov 2025","2025","37","12","6799","6819","A graph is a fundamental data model to represent various entities and their complex relationships in society and nature, such as social networks, transportation networks, financial networks, and biomedical systems. Recently, large language models (LLMs) have showcased a strong generalization ability to handle various natural language processing tasks to answer users’ arbitrary questions and generate specific-domain content. Compared with graph learning models, LLMs enjoy superior advantages in addressing the challenges of generalizing graph tasks by eliminating the need for training graph learning models and reducing the cost of manual annotation. However, LLMs are sequential models for textual data, but graphs are non-sequential topological data. It is challenging to adapt LLMs to tackle graph analytics tasks. In this survey, we conduct a comprehensive investigation of existing LLM studies on graph data, which summarizes the relevant graph analytics tasks solved by advanced LLM models and points out the existing challenges and future directions. Specifically, we study the key problems of LLM-based generative graph analytics (LLM-GGA) in terms of three categories: LLM-based graph query processing (LLM-GQP), LLM-based graph inference and learning (LLM-GIL), and graph-LLM-based applications. LLM-GQP focuses on an integration of graph analytics techniques and LLM prompts, including graph understanding and knowledge graphs and LLMs, while LLM-GIL focuses on learning and reasoning over graphs, including graph learning, graph-formed reasoning, and graph representation. We summarize the useful prompts incorporated into LLM to handle different graph downstream tasks. Moreover, we give a summary of LLM model evaluation, benchmark datasets/tasks, and a deep pro and cons analysis of the discussed LLM-GGA models. We also explore open problems and future directions in this exciting interdisciplinary research area of LLMs and graph analytics.","1558-2191","","10.1109/TKDE.2025.3609877","Hong Kong RGC(grant numbers:12200424,C2003-23Y); ","https://ieeexplore.ieee.org/stamp/stamp.jsp?arnumber=11192225","Graph;LLM;structure understanding;graph learning;graph representation;graph reasoning;survey","Cognition;Surveys;Semantics;Query processing;Knowledge graphs;Adaptation models;Recommender systems;Large language models;Data models;Analytical models","","4","","183","CCBY","2 Oct 2025","Dec. 2025","","IEEE","IEEE Journals"
"DMIA: A Disentangled-Based Method for Graph Convolutional Network Against Membership Inference Attack","R. Fang; Y. Sun; J. Yuan; H. Cao","Key Laboratory of Big Data & Artificial Intelligence in Transportation, Ministry of Education, Beijing, China; Key Laboratory of Big Data & Artificial Intelligence in Transportation, Ministry of Education, Beijing, China; Key Laboratory of Big Data & Artificial Intelligence in Transportation, Ministry of Education, Beijing, China; Key Laboratory of Big Data & Artificial Intelligence in Transportation, Ministry of Education, Beijing, China",IEEE Transactions on Dependable and Secure Computing,"12 Nov 2025","2025","22","6","7956","7970","As a well-known graph embedding method, Graph Convolutional Networks (GCNs) have been widely applied to recommendation systems and social media analysis, in which privacy concerns regarding sensitive data have emerged in the public view due to the collection of personal preferences. Although the regularization methods are introduced to improve the network's security, the GCN tends to memorize individual user information in latent representations susceptible to the Membership Inference Attack (MIA). In addition, the previous works focus on improving the security while hurting the utility, or vice versa, which induces “negative transfer”. In this paper, we propose a novel disentangled-based framework to defend MIA and alleviate the issue of negative transfer in multi-task learning. First, we divide the sensitive and practical channels from the latent representations of graph nodes to minimize their linear dependency. Then, to effectively train our model, we employ the sub-computational graphs to generate local gradients for different tasks and allocate losses to them. Finally, we propose a novel mixed updating strategy to accumulate the updating information of sub-computational graphs. Extensive experiments show that the proposed method can mitigate the risk of membership inference while ensuring model accuracy.","1941-0018","","10.1109/TDSC.2025.3602959","Fundamental Research Funds for the Central Universities(grant numbers:2025JBZX059); National Science and Technology Major Project(grant numbers:2021ZD0113002); National Natural Science Foundation of China(grant numbers:62402031,62072292,61572005); Fundamental Research Funds for the Central Universities(grant numbers:2024YJS126,2023YJS168); ","https://ieeexplore.ieee.org/stamp/stamp.jsp?arnumber=11141730","Disentangled representation learning;privacy protection;graph embedding;membership inference attack (MIA);multi-task learning","Privacy;Security;Training;Data models;Vectors;Graph convolutional networks;Social networking (online);Multitasking;Differential privacy;Accuracy","","1","","46","IEEE","26 Aug 2025","Nov.-Dec. 2025","","IEEE","IEEE Journals"
"The Property Graph Data Format (PGDF)","R. Angles; S. Ferrada; I. Burgos","Department of Computer Science, Faculty of Engineering, Universidad de Talca, Curicó, Chile; IMFD Chile, Santiago, Chile; IMFD Chile, Santiago, Chile",IEEE Access,"5 Nov 2024","2024","12","","159267","159279","Property graphs are popular in both industry and academia due to their versatility in modeling complex data across diverse application domains, ranging from social networks to knowledge graphs. Despite their popularity, there is no standardized data format for storing and exchanging property graphs. This paper introduces PGDF, a text-based data format for property graphs, designed to be both simple and flexible, while remaining expressive and efficient. The simplicity of PGDF comes from its tabular-like structure, where each line in a PGDF file contains a single schema or data declaration. PGDF offers great flexibility by allowing schema and data declarations to be combined in any order. This means that nodes and edges can each have their own distinct properties, providing greater adaptability and customization. The expressiveness of PGDF is defined by its ability to represent a wide range of property graph features. In this article, we describe the syntax and semantics of PGDF, outline methods for converting property graphs stored in multiple CSV files to PGDF and other graph data formats, and present an experimental evaluation comparing PGDF, YARS-PG, GraphML, and JSON-Neo4j. The experiments show that PGDF enables the production of smaller files more quickly compared to other graph data formats.","2169-3536","","10.1109/ACCESS.2024.3485685","Agencia Nacional de Investigación y Desarrollo (ANID) Millennium Science Initiative Program(grant numbers:ICN17_002); ANID Fondo Nacional de Desarrollo Científico y Tecnológico (FONDECYT) Chile(grant numbers:1221727); ","https://ieeexplore.ieee.org/stamp/stamp.jsp?arnumber=10734106","Graph databases;property graphs;graph data formats;PGDF","Contracts;XML;Syntactics;Social networking (online);Periodic structures;Object recognition;Knowledge graphs;Distance measurement;Database systems;Data models","","","","16","CCBYNCND","24 Oct 2024","2024","","IEEE","IEEE Journals"
"Counter-Intuitive Characteristics of Rational Decision-Making Using Biased Inputs in Information Networks","H. Kesavareddigari; A. Eryilmaz","Department of Electrical and Computer Engineering, The Ohio State University, Columbus, OH, USA; Department of Electrical and Computer Engineering, The Ohio State University, Columbus, OH, USA",IEEE/ACM Transactions on Networking,"17 Aug 2021","2021","29","4","1774","1785","We consider an information network comprised of nodes that are: rational-information-consumers (RICs) and/or biased-information-providers (BIPs). Making the reasonable abstraction that any external event is reported as an answer to a logical statement, we model each node’s information-sharing behavior as a binary channel. For various reasons, malicious or otherwise, BIPs might share incorrect reports of the event regardless of their private beliefs. In doing so, a BIP might favor one of the two outcomes, exhibiting intentional or unintentional bias (e.g. human cognitive biases). Inspired by the limitations of humans and low-memory devices in information networks, we previously investigated a graph-blind rational-information-consumer interested in identifying the ground truth. We concluded that to minimize its error probability, graph-blind RIC follows a counter-intuitive but tractable rule. In this work, we build on this foundational knowledge: “graph-blind RICs prefer the combination of information-providers that are all fully-biased against the a-priori likely input, over all other combinations.” Upon studying RICs with partial knowledge of the network graph, we find that they act similar to graph-blind RICs when their BIPs “listen to” sufficiently many information-providers of their own. Furthermore, if a common node is informing/influencing all  $n$  BIPs of a partially-aware RIC, that RIC anticipates its discovery of the “influential node” to diminish the average error probability by a factor that increases exponentially with  $n$ . However, from the partially-aware RIC’s perspective, choosing  $n$  fully-, similarly-biased BIPs outweighs the discovery of influential nodes among its BIPs’ sources. These insights might inform the design of consumer-centric information networks.","1558-2566","","10.1109/TNET.2021.3075430","NSF(grant numbers:CNS-NeTS-1514260,CNS-NeTS-1717045,CMMI-SMOR-1562065,CNS-ICN-WEN-1719371,CNS-SpecEES-1824337,CNS-NeTS-2007231); Office of Naval Research (ONR)(grant numbers:N00014-19-1-2621); Defense Threat Reduction Agency (DTRA)(grant numbers:HDTRA1-15-1-0003,HDTRA1-18-1-0050); ","https://ieeexplore.ieee.org/stamp/stamp.jsp?arnumber=9423868","Rational decision-making;information networks;statistical decision theory;cognitive bias;data fusion","Social networking (online);Knowledge engineering;IEEE transactions;Error probability;Decision making;Sensors;Random variables","","","","22","IEEE","5 May 2021","Aug. 2021","","IEEE","IEEE Journals"
"SpeGCL: Self-Supervised Graph Spectrum Contrastive Learning Without Positive Samples","Y. Shou; X. Cao; D. Meng","School of Computer Science and Technology, Ministry of Education Key Laboratory for Intelligent Networks and Network Security, Xi’an Jiaotong University, Xi’an, Shaanxi, China; School of Computer Science and Technology, Ministry of Education Key Laboratory for Intelligent Networks and Network Security, Xi’an Jiaotong University, Xi’an, Shaanxi, China; School of Mathematics and Statistics and the Ministry of Education Key Laboratory of Intelligent Networks and Network Security, Xi’an Jiaotong University, Xi’an, Shaanxi, China",IEEE Transactions on Neural Networks and Learning Systems,"29 Oct 2025","2025","36","11","19546","19559","Graph contrastive learning (GCL) has emerged as a powerful method for dealing with noise and fluctuations in graph-structured data, and can be applied to social networks and knowledge graphs. Although various graph augmentation strategies have emerged in the field of GCL, traditional graph convolutional network (GCN) mainly tends to preserve smooth features and has difficulty capturing fine-grained changes between different views. To address the above issue, we first construct Fourier graph neural network (FourierGNN) from the perspective of graph spectrum learning, which captures different frequency components by stacking multiple Fourier graph operations (FGO) layers in Fourier space. Then, we find that the difference between the high-frequency information of two augmented graphs should be larger than the difference between the low-frequency information. Next, we theoretically prove that focusing only on pushing negative pairs farther away can more effectively achieve performance advantages. By leveraging these discoveries, we propose a novel self-supervised graph spectrum contrastive learning framework, i.e., SpeGCL, and design an effective contrastive strategy to optimize this goal. We also provide a theoretical justification for the efficacy of using only negative samples in SpeGCL. Extensive experiments have been conducted on unsupervised, transfer, and semi-supervised learning tasks to show that SpeGCL outperforms existing state-of-the-art (SOTA) GCL methods.","2162-2388","","10.1109/TNNLS.2025.3589861","National Natural Science Foundation of China(grant numbers:62272375,62272374,62192781,62250009,62137002); Natural Science Foundation of Shaanxi Province(grant numbers:2024JC-JCQN-62); Project of China Knowledge Center for Engineering Science and Technology; Project of Chinese Academy of Engineering “The Online and Offline Mixed Educational Service System for ‘The Belt and Road’ Training in MOOC China”; Tianyuan Fund for Mathematics of the National Natural Science Foundation of China(grant numbers:12426105); Major Key Project of Pengcheng Laboratory(grant numbers:PCL2024A06); ","https://ieeexplore.ieee.org/stamp/stamp.jsp?arnumber=11104071","Data augmentation;graph contrastive learning;graph representation learning;graph spectrum","Contrastive learning;Representation learning;Training;Convolutional neural networks;Stacking;Frequency-domain analysis;Time-domain analysis;Supervised learning;Spectral analysis;Social networking (online)","","5","","70","IEEE","30 Jul 2025","Nov. 2025","","IEEE","IEEE Journals"
"DeepNM: Incremental Graph Matching Based on Sinkhorn Similarity","Y. Xia; J. Chen; X. Li; J. Gao","Key Laboratory of High Confidence Software Technologies, CS, Peking University, Hai Dian Qu, Beijing, China; Key Laboratory of High Confidence Software Technologies, CS, Peking University, Hai Dian Qu, Beijing, China; Big data and Artificial Intelligence, China Telecom Research Institute, Changping, Beijing, China; Key Laboratory of High Confidence Software Technologies, CS, Peking University, Hai Dian Qu, Beijing, China",IEEE Transactions on Knowledge and Data Engineering,"7 Aug 2025","2025","37","9","5141","5157","Graph matching is a critical task with diverse real-world applications. Current cutting-edge methodologies incorporate GNN (Graph Neural Network) combined with incremental anchor refinement, calculating the matching similarity directly via node embeddings. However, the direct similarity computation based on aggregated embeddings from GNN may obscure the distinctiveness of nodes within a localized region. In addition, the possible wrongly added anchor pairs in the iterations and the lack of capturing the relationships to anchors may further affect the performance. In order to tackle these challenges, this paper proposes a method named DeepNM, which attempts to find node matching based on their neighbors’ similarities. Specifically, DeepNM introduces a Sinkhorn-based similarity on a node’s neighborhood’s embeddings, which serves as both a training loss and a matching metric tailored to the graph matching problem. Additionally, we demonstrate that the Sinkhorn-based similarity, which relies on common neighbor statistics, is highly resilient to inaccurately identified anchor pairs within the context of incremental graph matching. Our comprehensive experiments on synthetic and real-world datasets demonstrate that DeepNM, compatible with the incremental graph matching paradigm, excels particularly well at matching graphs where common neighbors provide good matches. Applying the DeepNM pipeline to real social networks results in a 6% improvement, and applying the Sinkhorn similarity on knowledge graphs results in an average improvement of 1.7% over the best baseline.","1558-2191","","10.1109/TKDE.2025.3583059","National Natural Science Foundation of China(grant numbers:62272008); Peking University-China Telecom Joint Laboratory for Big Data; ","https://ieeexplore.ieee.org/stamp/stamp.jsp?arnumber=11051053","Graph matching;common neighbors;graph neural network;incremental matching","Graph neural networks;Measurement;Training;Computational modeling;Robustness;Social networking (online);Aggregates;Pipelines;NP-hard problem;Matched filters","","1","","52","IEEE","25 Jun 2025","Sept. 2025","","IEEE","IEEE Journals"
"A Schema-Driven Synthetic Knowledge Graph Generation Approach With Extended Graph Differential Dependencies (GDDxs)","Z. Feng; W. Mayer; K. He; S. Kwashie; M. Stumptner; G. Grossmann; R. Peng; W. Huang","College of Informatics, Huazhong Agricultural University, Wuhan, China; Advanced Computing Research Centre, University of South Australia, Adelaide, SA, Australia; School of Computer Science, Wuhan University, Wuhan, China; CSIRO’s Data61, Adelaide, SA, Australia; Advanced Computing Research Centre, University of South Australia, Adelaide, SA, Australia; Advanced Computing Research Centre, University of South Australia, Adelaide, SA, Australia; School of Computer Science, Wuhan University, Wuhan, China; School of Information Systems and Management, Heinz College, Carnegie Mellon University in Australia, Adelaide, SA, Australia",IEEE Access,"12 Jan 2021","2021","9","","5609","5639","Knowledge Graphs (KGs), as one of the key trends which are driving the next wave of technologies, have now become a new form of knowledge representation, and a cornerstone for several applications from generic to specific industrial use cases. However, in some specific domains such as law enforcement, a real and large domain-oriented KG is often unavailable due to data privacy concerns. In such domains it is necessary to generate a synthetic KG which mimics the properties of a real KG in the domain. Although during the last two decades, a variety of graph data generators has been proposed to achieve the generation of different kinds of networks, the state-of-the-art synthetic graph data generators are not feasible to generate a realistic and synthetic KGs because KGs always contain data characteristics with specified semantics. In this work, we propose a schema-driven synthetic KG generation approach with extended graph differential dependencies (GDDx), which is an extension of the recently developed graph entity/differential dependencies that represent formal constraints for graph data to enable the generation of desired graph patterns in synthetic KG. Next, we develop an effective KG generation algorithm that employs the schema and the pre-defined GDDxs. Finally, we evaluate our synthetic KG generator and compare with several state-of-the-art synthetic graph generators. The results from the experiments show that our KG generation method can generate KGs that exhibit the desired graph patterns, node attributes and degree distributions associated with each entity type in the graph's schema.","2169-3536","","10.1109/ACCESS.2020.3048186","Data to Decisions Cooperative Research Centre (D2D CRC), Australia; National Key Research and Development Plan of China(grant numbers:2017YFB0503702); National Science Foundation of China(grant numbers:61672387); Fundamental Research Funds for the Chinese Central Universities(grant numbers:2662020XXQD01); ","https://ieeexplore.ieee.org/stamp/stamp.jsp?arnumber=9311121","Synthetic graph data;graph dependencies;data modeling;semantic-based graph generation","Generators;Task analysis;Inference algorithms;Australia;Semantics;Law enforcement;Data privacy","","17","","50","CCBY","30 Dec 2020","2021","","IEEE","IEEE Journals"
